{
  "kind": "CapabilityDefinition",
  "metadata": {
    "capability_id": "player-protection-case-review",
    "version": "0.1.0",
    "lifecycle_state": "Published"
  },
  "prompt": {
    "prompt_ref": "prompts/player-protection-case-review",
    "prompt_sha256": "1111111111111111111111111111111111111111111111111111111111111111"
  },
  "governance": {
    "risk_tier": "R1",
    "safety_envelope_ref": "default-r1-readonly@1.0.0",
    "execution_model": {
      "scopes": ["Reasoning"]
    }
  },
  "routing": {
    "llm_route": "llm_gateway",
    "allowed_model_families": ["bedrock"]
  },
  "identity": {
    "required_tags": ["tenant_id", "brand", "role", "use_case"]
  },
  "tool_bindings": [
    {
      "tool_id": "policy-search",
      "kind": "rag",
      "action_class": "read",
      "requires_identity_context": true
    },
    {
      "tool_id": "case-reader",
      "kind": "mcp",
      "action_class": "read",
      "requires_identity_context": true
    }
  ],
  "evaluation": {
    "evaluation_pack_ref": "player-protection-case-review@0.1.0"
  }
}
