{
  "kind": "CapabilityDefinition",
  "metadata": {
    "capability_id": "customer-360-specialist",
    "version": "1.0.0",
    "lifecycle_state": "Published"
  },
  "prompt": {
    "prompt_ref": "prompts/customer-360-specialist",
    "prompt_sha256": "9999999999999999999999999999999999999999999999999999999999999999"
  },
  "governance": {
    "risk_tier": "R0",
    "safety_envelope_ref": "default-r0-readonly@1.0.0",
    "execution_model": {
      "scopes": ["Reasoning"]
    }
  },
  "routing": {
    "llm_route": "llm_gateway",
    "allowed_model_families": ["bedrock"]
  },
  "identity": {
    "required_tags": ["tenant_id", "brand", "role", "use_case"]
  },
  "tool_bindings": [
    {
      "tool_id": "customer-360-reader",
      "kind": "mcp",
      "action_class": "read",
      "requires_identity_context": true
    }
  ],
  "evaluation": {
    "evaluation_pack_ref": "customer-360-specialist@1.0.0"
  }
}
